1959,Wait for It,Aagaard,Ivy,2.97
1985,Aloha from Hell (Sandman Slim #3),Aallonen,Sudie,1.63
1694,Fear and Loathing in Las Vegas,Aalto,Affie,7.99
1656,The Chosen One,Ababii,Salvatore,4.61
1841,The Short Victorious War (Honor Harrington #3),Abadias Morales,Joslyn,6.46
1862,Predator (Kay Scarpetta #14),Abaeva,Glennis,4.34
1772,Silk,Abaeva,Maritza,1.55
1732,The Thorn Birds,Abanda,Abbott,9.35
1799,The Candymakers (The Candymakers #1),Abanda,Dedric,7.65
1677,One Thousand Gifts: A Dare to Live Fully Right Where You Are,Abanda,Luciano,5.96
1663,The Sound of Glass,Abass,Armand,7.41
1697,Third Grave Dead Ahead (Charley Davidson #3),Abass,Ophelia,7.53
1994,Dragonsdawn (Pern #9),Abass,Wilma,1.42
1663,Crooked Kingdom (Six of Crows #2),Abaza,Jasiah,3.21
1922,Vengeance in Death (In Death #6),Abaza,Kim,5.46
1739,MacRieve (Immortals After Dark #14),Abaza,Shonda,4.14
1817,Less Than Zero,Abbas,Lolita,9.51
1965,Embrace (The Violet Eden Chapters #1),Abbassi,Devin,9.91
2012,Olive Kitteridge,Abbassi,Millicent,7.34
1807,Buddenbrooks: The Decline of a Family,Abbott,Jeanie,9.03
1949,Drums Girls & Dangerous Pie (Drums Girls & Dangerous Pie #1),Abbott,Stevan,6.54
1901,Deep (Stage Dive #4),Abbou,Hampton,6.12
1653,Found in You (Fixed #2),Abdala,Indiana,6.96
1818,If on a Winter's Night a Traveler,Abdala,Macel,1.77
1937,The Razor's Edge,Abdalla,Stafford,9.79
1907,Kitty and the Midnight Hour (Kitty Norville #1),Abdukadirova,Esequiel,9.83
1727,Evergreen,Abdukadirova,Jenelle,8.98
1785,One Summer,Abdukhalikova,Letta,7.47
1780,The Robe,Abdul Aal,Clella,8.77
1757,Angels & Demons  (Robert Langdon #1),Abdullaeva,Denisse,7.31
1722,Five Days at Memorial: Life and Death in a Storm-Ravaged Hospital,Abdullayeva,Cindi,9.96
1739,The Mist,Abdullayeva,Kali,6.71
1788,I Robot (Robot #0.1),Abdullayeva,Valerie,5.07
1797,The Lion and the Mouse,Abduraimova,Elzie,2.46
1690,In the Time of the Butterflies,Abduraimova,Lovett,9.82
2012,The Last Oracle (Sigma Force #5),Abe,Akeelah,9.85
1889,Figure Drawing for All It's Worth (How to draw and paint),Abe,Mareli,7.42
1920,Gray Mountain,Abe,Rhett,6.87
1765,Maskerade (Discworld #18; Witches #5),Abe,Tana,4.14
1836,Lean Mean Thirteen (Stephanie Plum #13),Abed,Zilpah,9.15
2006,Rumors of War (Children of the Promise #1),Abello,Kerrie,3.46
1693,East,Abeysinghe,Keanu,3.98
1752,The Snowman,Abeywardene,Colter,4.82
1823,On the Way to the Wedding (Bridgertons #8),Able,Vallie,4.08
2010,Fruits Basket Vol. 1,Ablovatchi,Berdie,8.99
1933,The Winter People,Ablovatchi,Sabrina,5.59
1677,All Marketers Are Liars: The Power of Telling Authentic Stories in a Low-Trust World,Abou El Ghar,Flonnie,5.43
1840,The Midwife's Revolt (The Midwife Series #1),Abou Farah Trigueros,Jakobe,4.23
1671,Dexter Is Delicious (Dexter #5),Abou Farah Trigueros,Jorge,9.15
1768,Tempting the Player (Gamble Brothers #2),Aboubakare,Harlie,8.33
1846,As the Crow Flies,Abraham,Jair,9.81
1807,Lost Stars (Star Wars: Journey to the Force Awakens),Abraham,Wesley,1.59
1917,The Chase (Isaac Bell #1),Abram,Marlee,6.65
1692,A Year Down Yonder (A Long Way from Chicago #2),Abram,Yetta,1.5
1902,Mister B. Gone,Abramovic,Bettye,1.58
1835,Honolulu,Abrams,Pleas,6.23
1780,Hope: A Memoir of Survival in Cleveland,Abramyan,Buena,7.88
1700,Nice Girls Don't Have Fangs (Jane Jameson #1),Abramyan,Rosaline,8.23
1914,The Creative License: Giving Yourself Permission to Be The Artist You Truly Are,Achlamov,Selmer,3.82
1813,Do-It-Yourself Book (Diary of a Wimpy Kid),Ackron,Seth,7.37
1704,The Enemy (The Enemy #1),Aconcha,Newton,8.77
1705,An Untamed State,Acosta,Portia,7.1
1894,Out of the Dark (The Grey Wolves #4),Acra,Geoffrey,1.67
1850,The Grand Sophy,Acuna,Gladstone,5.33
1779,Honor Among Enemies (Honor Harrington #6),Adachi,Brooklyn,5.11
1848,The Secret Diary of Adrian Mole Aged 13 3/4  (Adrian Mole #1),Adam,Aron,3.96
1728,Fireproof,Adamescu,Alfonse,5.59
1922,Mr. Popper's Penguins,Adamkova Guy,Loria,6.8
1911,Being Nikki (Airhead #2),Adams,Delia,7.35
1773,A Countess Below Stairs,Adams,Hermina,2.41
1688,Ice Station (Shane Schofield #1),Adar,Addie,1.88
1703,The Girl Who Fell from the Sky,Addie,Jovita,3.67
1951,Reading Lolita in Tehran,Adler,Lainey,4.97
1707,The Wealth of Nations,Adler,Zackery,3.13
1772,#GIRLBOSS,Adsuar,Doreen,2.66
1935,The Psychopath Test: A Journey Through the Madness Industry,Afanasyeva,Cassidy,5.02
1952,Maurice,Afanasyeva,Reno,9.31
1922,A Shadow of Light (A Shade of Vampire #4),Afinogenova,Mace,4.54
1987,Katherine,Agamennone,Alexus,7.71
1727,Habibi,Agarici,Loula,6.62
1888,Daisy Miller,Agarwal,China,4.41
1714,The Last Original Wife,Agassi,Jarrod,3.3
1678,Glass Sword (Red Queen #2),Agra,Margaret,7.75
1982,The Madness of Lord Ian Mackenzie (Mackenzies & McBrides #1),Aguado,Baxter,4.96
1693,The Undomestic Goddess,Aguado,Oliver,1.32
1686,Gifted Hands: The Ben Carson Story,Agudelo,Flonnie,8.57
1854,The Awakening (The Vampire Diaries #1),Agugbom,Benjiman,2.45
1836,Gut: The Inside Story of Our Body’s Most Underrated Organ,Agugbom,Rey,3.11
1978,Tales from a Not-So-Fabulous Life (Dork Diaries #1),Aguilar,Alvera,7.99
1676,Fiddler on the Roof,Aguilar,Bettye,1.09
1964,Rock Chick Revenge (Rock Chick #5),Aguilar,Daniele,6.7
1887,How I Raised Myself from Failure to Success in Selling,Aguilar,Felipa,5.51
1759,The Field of Swords (Emperor #3),Aguilar,Jelani,9.22
1903,Crash into You (Pushing the Limits #3),Aguilar,Jorja,7.59
1914,Good in Bed (Cannie Shapiro #1),Aguilar Sepulveda Francisca Gisella,Denise,8.94
1976,The Last Wife of Henry VIII,Aguilera,Norine,9.64
1696,Life and Times of Michael K,Aguirre,Alfonso,3.94
1955,Heat Lightning (Virgil Flowers #2),Aguirre,Fleda,8.11
1787,Milkweed,Aguirre Arteaga,Howell,2.82
1858,Dracula (Marvel Illustrated),Ahmetspahic,Katlyn,1.12
1913,Pleasure of a Dark Prince (Immortals After Dark #9),Ahn,Metta,5.16
1796,A Kingdom of Dreams (Westmoreland #1),Ahtemenciuc,Bettylou,4.36
1760,Grey (Fifty Shades #4),Ahuja,Cathey,5.14
1716,Brooklyn,Ahuja,Karma,6.57
1679,The Red Queen: Sex and the Evolution of Human Nature,Ahumada,Earnestine,3.89
2022,The Three (The Three #1),Aiava,Mercy,2.74
1805,Scoring Wilder,Aigner,Franz,2.76
2013,To Your Scattered Bodies Go (Riverworld #1),Aiko,Deward,5.43
1790,Always Looking Up: The Adventures of an Incurable Optimist,Aiko,Elbridge,6.86
1995,The Woman in Black,Ailloud,Jalen,2.18
1779,Kisscut (Grant County #2),Airhunmwunde,Camryn,4.47
2009,The King of Attolia (The Queen's Thief #3),Ait Ali Yahia,Rogers,6.69
1855,A Light in the Attic,Aizenberg,Farah,8.33
1766,The Dark Forest (Remembrance of Earth’s Past #2),Aizenberg,Helga,4.93
1925,The Vampire Armand (The Vampire Chronicles #6),Aizenberg,Isamar,4.07
1793,Grimm's Fairy Tales,Ajulo,Isadora,4.1
1826,Will Grayson Will Grayson,Ajulo,Savon,5.22
1748,Notes from a Small Island,Ajulo,Vivien,6.59
1772,The Strain (The Strain Trilogy #1),Akahori,Heriberto,7.35
1750,Hannibal (Hannibal Lecter #3),Akbacheva,Waino,2.32
1866,The Wind-Up Bird Chronicle,Akbari,Yolanda,8.32
1762,A Supposedly Fun Thing I'll Never Do Again:  Essays and Arguments,Akdemir,Elenora,5.65
1746,Don't Waste Your Life,Akewula,Cleola,5.95
1702,Much Ado About Nothing,Akhalaia,Carmelita,4.74
1881,The Iliad/The Odyssey,Akintunde,Jame,4.69
1846,Goddess Interrupted (Goddess Test #2),Akita,Sebastian,4.54
1791,Thunderstruck,Akkerman,Lavar,3.23
1776,A Discovery of Witches (All Souls Trilogy #1),Akl,Colter,5.77
1716,Turn of Mind,Akl,Ewin,3.27
1892,The Berenstain Bears and the Messy Room,Akovalier,Mikel,8.87
1826,Why Be Happy When You Could Be Normal?,Akramova,Gladyce,7.69
2001,Enchantment,Akrate,Lani,7.9
1953,Soul Eater Vol. 01 (Soul Eater #1),Akutsu,Aryan,1.5
1864,All the Birds in the Sky,Al Awaidy,Ferris,2.49
1911,Clariel (Abhorsen #4),Al Disi,Zebulon,1.27
1942,Hope to Die (Alex Cross #22),Al Ghannam,Josue,5.43
1860,Keeping Faith,Al Nabhani,Derrek,9.87
1858,The One Thing: The Surprisingly Simple Truth Behind Extraordinary Results,Aladashvili,Trisha,6.73
1849,The Distance Between Us,Alain,Latrina,7.1
1712,First Shift: Legacy (Shift #1),Albanese,Carra,9.35
1775,The Woman in the Dunes,Albanese,Wilburn,7.28
1909,Indulgence in Death (In Death #31),Albertalli,Frederica,7.91
1653,The Things We Do for Love,Albertini,Gidget,4.85
1913,Nation,Albie,Darlene,4.48
1794,Apt Pupil,Albinus,Cherish,5.2
1812,The Awakened Mage (Kingmaker Kingbreaker #2),Albizuri,Keon,2.89
1823,First Frost (Waverley Family #2),Albuquerque,Shad,5.57
2020,The Giving Tree,Alcini,Alice,4.05
1856,The Fireman,Aldana Estremera,Lura,9.31
1958,The Invisible Gorilla: And Other Ways Our Intuitions Deceive Us,Alecsiu,Jeremiah,3.37
2011,61 Hours (Jack Reacher #14),Alegre,Tillman,9.06
1949,A Thousand Acres,Alenas,Clabe,6.26
1780,The Waste Lands (The Dark Tower #3),Alenas,Vicie,5.25
2013,Sweet Home (Sweet Home #1),Alesha,Daphne,1.76
1800,Terms of Endearment,Alesiani,Willaim,4.41
1757,The Wee Free Men (Discworld #30; Tiffany Aching #1),Alessi,Debrah,7.51
1842,Annihilation (Southern Reach #1),Alexander,Arlene,4.42
1719,The Kitchen God's Wife,Alexander,Ashlie,3.12
1773,Hostile Witness (Witness Series #1),Alexander,Issac,2.09
1792,D-Day June 6 1944: The Battle for the Normandy Beaches,Alexandrou,Justyn,9.02
1954,Crossing the Chasm: Marketing and Selling High-Tech Products to Mainstream Customers,Alexandrou,Vernie,8.41
1885,The Case-Book of Sherlock Holmes,Alexandru,Silas,8.94
1986,Smooth Talking Stranger (Travises #3),Alexeeva,Daulton,8.19
1836,The Fairy-Tale Detectives (The Sisters Grimm #1),Alexsandrova,Anton,3.87
2015,Tennis Shoes Among the Nephites (Tennis Shoes #1),Alexsandrova,Nelly,9.02
1938,Going Solo,Alford,Edmond,6.81
1909,The Return of the Native  ,Alfredsson,Cayla,2.39
1703,Agent to the Stars,Alhach,Maxine,3.29
1748,Henry & Ramona,Alina,Johnathan,9.15
1879,A Hero of Our Time,Alina,Orah,9.65
1758,Witches of East End (The Beauchamp Family #1),Allan,Elby,2.87
1725,Left Behind (Left Behind #1),Allen,Alpha,3.18
1682,Last Man Standing,Allen,Gabrielle,1.72
1989,The Assassin and the Empire (Throne of Glass #0.5),Allen,Humphrey,7.37
1880,The Brief Wondrous Life of Oscar Wao,Allen,Janene,4.62
1884,The Traveler's Gift: Seven Decisions that Determine Personal Success,Allertova,Vester,5.8
1938,The Book of Life (All Souls Trilogy #3),Almansa,Mollie,5.72
1902,Fade Out (The Morganville Vampires #7),Almansa,Trina,4.59
1899,Startide Rising (The Uplift Saga #2),Almeda Singian,Gladyce,3.87
1806,Crescendo (Hush Hush #2),Almeida,Loda,7.21
2012,What's So Amazing About Grace?,Almgren,Kenna,4.19
1682,Czas pogardy (Saga o Wiedźminie #4),Almudever Folch,Jazmine,5.78
1760,After (After #1),Alonso,Alwina,5.32
1831,The Warded Man (Demon Cycle #1),Alonso,Elana,2.02
1921,Fahrenheit 451: The Authorized Adaptation,Alonso Martinez,Gearldine,3.18
1784,Big Magic: Creative Living Beyond Fear,Alpay,Emry,3.43
1986,The Demon-Haunted World: Science as a Candle in the Dark,Alpert,Cael,1.18
1733,What to Expect the First Year (What to Expect),Alpert,Jaylon,8.29
1930,Living Dead Girl,Alptekin,Santos,7.84
1778,Private #1 Suspect (Private #2),Alquier,Kelan,2.09
1739,Teen Idol,Alquier,Marlys,6.32
1835,Madame Tussaud: A Novel of the French Revolution,Altay,Jeffery,7.96
1772,Delta of Venus,Altay,Lambert,1.09
1798,Small Island,Altick,Bianca,4.91
1868,Bad Things (Tristan & Danika #1),Altilia,Margy,5.75
1800,The Creative Habit: Learn It and Use It for Life,Altman,Josefita,3.25
1682,Disclosure,Alvarado,Ernie,9.76
1891,Practical Demonkeeping (Pine Cove #1),Alvarez,Hasan,9.29
1742,Beast Master Vol. 1 (Beast Master #1),Alvarez,Hayden,5.6
1728,It Chooses You,Alvarez,Treyvon,4
1758,Very Valentine,Alvarez,Tristen,8.04
1827,Grendel,Alvarez Bilbao,Dominque,2.62
1728,Oh The Places You'll Go!,Alvarez Gerochristodoulou,Deb,2.44
1742,Anne Rice's The Tale of the Body Thief (A Graphic Novel),Alvarez Riobo,Berton,6.39
1739,Orlando,Alvarez Riobo,Dominga,2.44
1886,Firefly Lane (Firefly Lane #1),Alvaro,Ty,1.68
2023,Money,Alves,Jethro,5.39
1689,The Secret Life of CeeCee Wilkes,Alves,Linnea,7.16
1898,Full Black (Scot Harvath #10),Alves Castellanos,Osa,8.04
1829,Death on the Nile (Hercule Poirot #17),Alves Comesana,Latonia,6.58
1986,Angel (Maximum Ride #7),Alzate Esmurzaeva,Bjorn,4.33
1697,Cibola Burn (The Expanse #4),Alzate Esmurzaeva,Oliva,6.14
1948,Carry On Mr. Bowditch,Amanmuradova,Kayla,7.05
1832,The Devil's Punchbowl,Amaral,Dawna,5.32
2017,Wolf Hall (Thomas Cromwell #1),Ambaye,Manervia,8.65
1932,The Sandcastle Girls,Amiach,Brea,7.68
1845,Dream Warrior (Dream-Hunter #4; Dark-Hunter #17),Amiach,Ronnie,2.44
1927,Saga Vol. 5 (Saga #5),Amiach,Viviana,8.35
1817,Flyboys: A True Story of Courage,Amin,Kirk,2.64
1842,Factotum,Amin,Maxwell,2.55
1940,Nothing to Lose (Jack Reacher #12),Amiraghyan,Adelina,8.58
1730,The Mote in God's Eye,Amiraghyan,Vicie,5.12
1830,The Blinding Knife (Lightbringer #2),Amiri,Vergil,4.11
1884,Naked Empire (Sword of Truth #8),Amo Flores,Festus,1.5
2001,To Kill a Mockingbird,Amoranto,Kirsten,2.47
2015,Death Comes to Pemberley,Ampuero,Paxton,6.6
1746,The Good Soldier,Anastasijevic,Jana,5.17
1748,Live and Let Die (James Bond #2),Anastasiu,Sybil,8.58
1787,The Island of the Day Before,Anastasiu,Tollie,5.95
1727,Second Son (Jack Reacher #15.5),Ancic,Jahir,9.97
1752,The Son of Neptune (The Heroes of Olympus #2),Andemariam,Nathalie,9.59
1772,The Coffin Dancer (Lincoln Rhyme #2),Anderholm,Tyrique,1.93
1790,Temple of the Winds (Sword of Truth #4),Anderson,Demario,4.39
1835,Elon Musk: Inventing the Future,Anderson,Katlyn,2.32
1670,Inés of My Soul,Andersson,Cristine,8.54
1956,One Day in the Life of Ivan Denisovich,Andersson,Kaleb,5.51
1946,Tintin in the Land of the Soviets (Tintin #1),Andersson,Nannie,3.02
1780,Y: The Last Man Vol. 8: Kimono Dragons (Y: The Last Man #8),Andersson,Talan,6.78
1793,The Taming of the Queen (The Plantagenet and Tudor Novels #11),Andonegui,Elenor,7.53
1875,Crooked Letter Crooked Letter,Andornino,Ladonna,7.89
1829,Blueberries for Sal,Andrade,Davonta,4.35
1975,Beach Music,Andrade,Isidro,4.81
1953,Betrayal in Death (In Death #12),Andrade,Joshuah,7.18
1870,Zone One,Andrade,Lexis,8.75
1898,Escape from Camp 14: One Man's Remarkable Odyssey from North Korea to Freedom in the West,Andrade,Mayo,9.28
1666,Discipline and Punish: The Birth of the Prison,Andrade,Mylee,1.78
1737,Kitten's First Full Moon,Andrade,Pauline,1.66
1941,Half a King (Shattered Sea #1),Andrade,Shelbi,1.43
2020,Rogues,Andrade,Tyrin,5.71
1739,The King (Black Dagger Brotherhood #12),Andreoni,Joseluis,8.51
2013,The Devil's Star (Harry Hole #5),Andres Gomez,Sarah,8.36
1864,The Elegance of the Hedgehog,Andres Rodriguez,Donovan,9.22
1781,The Whistler,Andrew,Chrissie,1.52
1720,Call Me by Your Name,Andrew,Kristan,1.88
1908,Alert (Michael Bennett #8),Andrews,Deonte,2.91
2006,He's Just Not That Into You: The No-Excuses Truth to Understanding Guys,Andrinopoulos,Orville,6.62
1769,The Nightmare (Joona Linna #2),Ang,Harlon,6.31
1686,The Egg,Ang,Kathi,5.19
1781,Metaphysics,Ang,Maye,5.46
1898,The Narrows (Harry Bosch #10; Harry Bosch Universe #12),Angat,Judd,8.6
1713,The Dinner,Angeles Paz,Clint,8.8
1985,White Oleander,Anggarkusuma,Carolyn,7.88
1813,The Stand: Soul Survivors,Anghelescu,Gabriella,7.33
1729,Gone (Quincy & Rainie #5),Anghelescu,Leigh,1.24
2012,Scott Pilgrim Volume 6: Scott Pilgrim's Finest Hour,Anglesjo,Talen,2.46
1843,Airhead (Airhead #1),Anikanova,Levina,7.92
1807,In Search of Schrödinger's Cat: Quantum Physics and Reality,Anikanova,Theresia,7.79
1896,Love & Misadventure,Anikanova,Truman,1.93
1908,The Space Between Us,Anikina,Audrey,8.23
1724,Aura,Ankutse,Tamatha,3.92
1937,The Infinite Sea (The 5th Wave #2),Anshba,Murray,5.01
2007,The Matlock Paper,Anstey,Seldon,6.46
1739,Rudolph the Red-Nosed Reindeer,Anthony,Remington,9.99
1839,City of Glass (The Mortal Instruments #3),Antonakis,Burke,4.17
1938,Wondrous Strange (Wondrous Strange #1),Antonakis,Chelsy,2.45
1794,When Things Fall Apart: Heart Advice for Difficult Times,Antonakis,Press,1.22
1938,The Fever,Antonana Iriarte,Ina,4.64
1747,Castle in the Air (Howl's Moving Castle #2),Antonana Iriarte,Obie,3.9
1859,Leo,Antonoplis,Marin,5.04
1951,Waiting For You,Antonoplis,Myrtis,2.94
1764,The Devil's Alternative,Antosik,Alivia,1.55
1912,The Finding (Law of the Lycans #5),Antypina,Emile,9.59
1681,Nefertiti,Anuchan,Darrel,3.19
2002,The Mephisto Club (Rizzoli & Isles #6),Anzola,Louise,1.76
1934,The Unusual Suspects (The Sisters Grimm #2),Aoki,Shelly,7.4
1709,Die for Me (Revenants #1),Apaolaza Miradevilla,Christa,3.01
1659,Fear Nothing (Moonlight Bay #1),Apaolaza Miradevilla,Zaria,4.53
1880,Sweetheart (Archie Sheridan & Gretchen Lowell #2),Apostu,Avery,3.74
1968,Epilogue (The Dark Duet #3),Appel,Elida,7.81
1989,The Power of Myth,Appelmans,Junius,7.43
1967,Of Mice and Men,Applebaum,Shanon,9
1814,Seconds,Appleton,Dale,6.05
1926,Shadow Spell (The Cousins O'Dwyer Trilogy #2),Aquino Aragon,Lawanda,9.43
1812,He Chose the Nails,Aquino Aragon,Loyce,1.87
1875,Master of the Senate (The Years of Lyndon Johnson #3),Arabadji,Dillie,7.63
1706,Soul Harvest: The World Takes Sides (Left Behind #4),Aranda Nunez,Zola,1.16
1777,Lament: The Faerie Queen's Deception (Books of Faerie #1),Arandia,Jeremiah,9.4
1746,Insatiable (Insatiable #1),Arantekin,Dixie,3.89
1811,The Bluest Eye,Araujo,Alyce,8.13
1847,The China Study: The Most Comprehensive Study of Nutrition Ever Conducted And the Startling Implications for Diet Weight Loss And Long-term Health,Aravena,Nellie,6.51
1923,Kim,Aravena,Tracey,8.92
1725,The Invisible Bridge,Arcangeli,Reilly,6.29
1678,Food Rules: An Eater's Manual,Arce,Chip,2.09
1974,Magic Hour,Arce Riquelme,Genoveva,3.49
1692,Beauty from Pain (Beauty #1),Archip,Carlene,4.61
2003,The Rumor,Archita,Cordella,1.7
1790,My Favorite Mistake (My Favorite Mistake #1),Arcila,Newton,3.68
2003,Zita the Spacegirl (Zita the Spacegirl #1),Arcos,Gregory,1.32
1824,The Silkworm (Cormoran Strike #2),Ardies,Suzan,7.27
1996,The Sisterhood of the Traveling Pants (Sisterhood #1),Ardila Cuervo,Evelin,3.31
1917,The Retribution of Mara Dyer (Mara Dyer #3),Ardila Cuervo,Theda,9.42
1813,Deceptively Delicious: Simple Secrets to Get Your Kids Eating Good Food,Arechavaleta,Irva,7.99
1898,The Murder of Roger Ackroyd (Hercule Poirot #4),Arevalo,Belen,8.66
1742,Goodnight Moon,Arfaoui,Trever,4.15
1973,Battle Cry of Freedom,Argeri,Elvin,2.07
1902,Tales of Ordinary Madness,Arginbayeva,Aniyah,1.04
1743,The Terror,Arias Manjon,Anita,2.21
1817,The Soldier's Wife,Ariyana,Fanny,3.39
1896,I Capture the Castle,Arkbrant,Christopher,1.51
1867,Gregor and the Marks of Secret (Underland Chronicles #4),Armet Sanpere,Manuela,7.84
1877,I Am Number Four (Lorien Legacies #1),Armet Sanpere,Melvin,3.23
1697,The Walking Dead Compendium 1,Armienta,Kael,9.13
1662,Catch-22,Armitano,Lex,9.29
1983,The Silent Girl (Rizzoli & Isles #9),Armitano,Lutie,8.09
1704,Great North Road,Armstrong,Jamil,1.47
1788,Twelfth Grade Kills (The Chronicles of Vladimir Tod #5),Armstrong,Meg,6.88
2013,We Should All Be Feminists,Arn,Buelah,4.83
1898,Outliers: The Story of Success,Arnaout,Brenden,1.91
1954,A Bite to Remember (Argeneau #5),Arnaout,Budd,4.02
2019,The Lost Hero (The Heroes of Olympus #1),Arnaout,Sylvia,5.32
1959,The Two Towers (The Lord of the Rings #2),Arnaud,Annamae,6.49
1779,Kushiel's Avatar (Phèdre's Trilogy #3),Arnaud,Marcelo,6.74
1802,Defiance (Significance #3),Arnez  Mercado,Dorothea,6.31
1893,Turning Angel,Arnold,Dondre,2.53
1933,My Soul to Save (Soul Screamers #2),Arphanukul,Chaney,3.62
1777,Homecoming (Tillerman Cycle #1),Arrangoiz,Jacob,4.92
1804,Size 12 Is Not Fat (Heather Wells #1),Arrangoiz,Jessica,3.61
1788,The Mill on the Floss,Arreola,Sherree,9.28
1963,Blue Ocean Strategy: How To Create Uncontested Market Space And Make The Competition Irrelevant,Arribas,Blair,1.82
1895,Absent In The Spring,Arroyo Vergara,America,9.18
1688,The Bedwetter: Stories of Courage Redemption and Pee,Arroyo Vergara,Sylvanus,2.06
1786,Being and Time,Arruabarrena,Desmond,6.71
1652,Absolute Fear (New Orleans #4),Arruabarrena Vecino,Elaine,8.97
1686,The Short Stories,Arsic,Florrie,6.12
1836,Chopsticks,Arsic,Riya,1.17
1687,Drama,Arslan,Shardae,3.99
1728,The Sailor Who Fell from Grace with the Sea,Artaza Martin,Jeannine,3.36
1768,A Year in Provence,Artemova,Regan,3.97
1983,Everyone Brave is Forgiven,Arthur,Denita,9.63
1687,Witches Abroad (Discworld #12; Witches #3),Arutyunova,Earnestine,1.61
2010,Ida B. . . and Her Plans to Maximize Fun Avoid Disaster and (Possibly) Save the World,Arvidsson,Nasir,2.56
1973,The Dark Tower (The Dark Tower #7),Aryani,Odette,9.43
1683,The Illustrated Mum,Asagoe,Trace,5.4
2004,The Outcasts (Brotherband Chronicles #1),Asatrian,Maybelle,4.11
2007,One Good Turn (Jackson Brodie #2),Asberg,Katlynn,5.71
1673,Cross Country (Alex Cross #14),Asciak,Irven,4.73
1942,The Twelve Caesars,Asensos,Dove,7.15
1672,Airborn (Matt Cruse #1),Asghar,Lenord,3.66
2004,Phantom (Sword of Truth #10),Ashley,Diandra,4.57
1748,A Walk Across the Sun,Ashley,Rillie,1.25
1688,The Saggy Baggy Elephant (A Little Golden Book),Asimova,Eloy,3.41
2021,Revelations (Blue Bloods #3),Asimova,Roosevelt,4.74
1748,Batman: The Man Who Laughs,Asis Espuche,Kareem,5.87
1700,Big Brother,Askew,Bryant,8.02
1942,The Language of Flowers,Askew,Charlie,6.65
1661,Hush Hush (Hush Hush #1),Askew,Agusta,2.22
1675,That Old Cape Magic,Askew,Sharlene,8.71
1980,The Ice Limit (Ice Limit #1),Assal,Demetrios,8.75
1921,Vampireville (Vampire Kisses #3),Asteri,Carrie,7.69
1977,5 cm,Asteri,Jarred,7.31
1776,Job: A Comedy of Justice,Asteri,Miracle,3.63
1869,First They Killed My Father: A Daughter of Cambodia Remembers,Astrini,Roseann,5.14
1898,The Enchantress (The Secrets of the Immortal Nicholas Flamel #6),Astrogo,Dossie,6.7
1921,The Wayfarer Redemption (Wayfarer Redemption #1),Astrogo,Shayne,6.58
1899,Orange Is the New Black,Asuaje,Brittnee,4.19
1810,Renegade's Magic (Soldier Son #3),Ates,Janell,2.33
1675,The Royal Ranger (Ranger's Apprentice #12),Athanasiadis,Elden,9.33
1979,Incarnate (Newsoul #1),Atlan,Leah,7.03
1680,The Codex,Atlan,Twyla,1.48
1832,Anne Frank : The Biography,Attia Abdalla,Malcom,7.6
1902,Anti-Stepbrother,Attili Pereira,Assunta,7.18
1969,The Atlantis Gene (The Origin Mystery #1),Atzori,Devontae,6.57
1737,First Comes Love,Atzori,Alexandrea,3.25
2012,Awakening the Buddha Within: Tibetan Wisdom for the Western World,Atzori,Machelle,6.34
1802,Once We Were Brothers,Aubet,Carley,6.66
1791,Ripper,Aubone,Bettyjane,4.21
1755,The Known World,Audra,Ottie,6.87
1743,A Good Yarn (Blossom Street #2),Audrina,Marely,7.78
1935,The Aleph and Other Stories ,Auer,Ebert,1.5
1877,Motherless Brooklyn,Auer,Lutie,7.35
1912,Salt: A World History,Auer,Reese,5.87
1925,Ballet Shoes (Shoes #1),Auer,Reuben,3.16
1867,Sophie & Carter,Aulana,Markus,4.03
1909,The Zahir,Aureli,Judge,2.41
2013,Talent is Overrated: What Really Separates World-Class Performers from Everybody Else,Aureli,Kenia,4.44
1905,Shatterproof (The 39 Clues: Cahills vs. Vespers #4),Auroux,Noble,1.14
1862,The Pioneer Woman Cooks: Food from My Frontier ,Austin,Merl,1.47
1954,Batman and Son,Avakova,Mable,1.43
1938,Sputnik Sweetheart,Avdiyenko,Deandra,3.24
1748,Made in America: An Informal History of the English Language in the United States,Avdzhiyan,Canyon,6.12
1716,Life of Pi,Avgeri,Carson,1.98
1671,Big Red (Big Red #1),Avgerinos,Kailyn,5.42
1733,Saga Vol. 3 (Saga #3),Aviles,Jere,4.32
1805,The History of Sexuality Volume 1: An Introduction,Aviles,Karie,6.95
1914,True Blue,Aviles,Mettie,5.56
1731,Earth Abides,Aviles,Zelda,6.54
1677,Lady Cottington's Pressed Fairy Book,Avirvarei,Jere,1.57
1880,The Dovekeepers,Avis,Kaila,9.58
1803,Gentlemen of the Road,Avis,Susana,9.14
1919,Flesh and Blood (Kay Scarpetta #22),Avola,Michal,4.52
1877,All My Sons,Avram,Ilda,3.96
1761,Close Range,Avvantaggiati,Jeramy,6.94
1695,Shutter Island,Axmedova,Caldonia,1.7
1763,Blood Cross (Jane Yellowrock #2),Ay,Pallie,1.25
1960,Dewey: The Small-Town Library Cat Who Touched the World,Ayala,Genevieve,1.88
1987,The Railway Children,Ayala Villacorta,Antonia,5.23
1696,One Flew Over the Cuckoo's Nest,Ayassamy,Tavaris,8.21
1986,Deadline (Newsflesh Trilogy #2),Ayegbusi,Alijah,6.93
1977,Forever Odd (Odd Thomas #2),Ayre,Austyn,6.16
1814,Autobiography of a Face,Ayre,Clemente,5.79
1694,Wayside School Is Falling Down (Wayside School #2),Ayre,Kaylen,9.96
1733,Bones of the Hills (Conqueror #3),Ayu Dewi,Mossie,2.12
1685,Without You There Is No Us: My Time with the Sons of North Korea's Elite,Ayzatulina,Jerilyn,6.11
1791,Specter of the Past (Star Wars: The Hand of Thrawn #1),Azarenka,Mariano,6.91
2010,The Pursuit of Happyness,Azcui,Lamarcus,3.75
1950,All My Friends Are Dead,Azcui,Riley,8.16
1691,Hidden Figures: The American Dream and the Untold Story of the Black Women Mathematicians Who Helped Win the Space Race,Azgari,Reginald,8.06
1957,Broken Grace,Azimova,Breann,9.82
1969,The Jungle Books,Azimova,Emmons,4.15
1833,The Mystery of the Blue Train (Hercule Poirot #6),Azimova,Jaylen,8.03
1723,Night Star (The Immortals #5),Azimova,Stephan,6.92
1823,The Passage (The Passage #1),Aziz,Keila,1.53
1838,Love Anthony,Azzouni,Robbin,2.23
1961,The Nasty Bits: Collected Varietal Cuts Usable Trim Scraps and Bones,Babayan,Gerrit,9.08
1825,The Magician's Land (The Magicians #3),Babel,Dixie,8.09
1818,Heart of Darkness and The Secret Sharer,Babet,Hermina,5.88
1992,The Moonstone,Babic,Clarabelle,7.39
1896,Sister,Babilon,Horton,1.73
1877,Friends and Lovers,Babilon,Melony,2.18
1872,The Search,Babos,Cleo,7.64
2014,Just One Year (Just One Day #2),Babos,Gauge,7.33
1739,City of the Beasts (Eagle and Jaguar #1),Babu Raj,George,10
1829,Dear Daughter,Babushkina,Maud,8.78
1907,Big Nate Strikes Again (Big Nate Novels #2),Baca Villagomez,Tawana,3.38
1725,X-Men: The Dark Phoenix Saga,Baccarani,Freddie,9.36
1697,Sweet Surrender (Sweet #1),Bacher,Vesta,3.4
1968,The Solitaire Mystery: A Novel About Family and Destiny,Bacheva,Martez,5.33
1724,Having Our Say: The Delany Sisters' First 100 Years,Bachmann,Kaydence,7.05
1827,After Anna,Bachmann,Renea,6.66
1712,Dr. Faustus,Bachmann,Aaden,5.12
1931,Percy Jackson and the Olympians Boxed Set (Percy Jackson and the Olympians #1-5),Bachmanova,Eldora,4.63
1676,The Invaders (Brotherband Chronicles #2),Bachofer,Solomon,8.69
