1692,Free Four: Tobias Tells the Divergent Knife-Throwing Scene (Divergent #1.5),Fontelles,Katlyn,1.66
1705,Waking Up: A Guide to Spirituality Without Religion,Fonts,Ernestine,8.49
1918,The Night Strangers,Fonts,Sterling,6.13
1735,Where Men Win Glory: The Odyssey of Pat Tillman,Ford,Sarina,3.74
1846,The Laughing Corpse (Anita Blake Vampire Hunter #2),Foretz Gacon,Oda,4.36
2014,So Long and Thanks for All the Fish (Hitchhiker's Guide to the Galaxy #4),Fornes Marques,Aydin,8.24
1815,Gabriel's Redemption (Gabriel's Inferno #3),Forster,Fritz,3.2
1865,Lolita,Forstner,Carlotta,9.67
1719,Debt Inheritance (Indebted #1),Forte,Doyle,2.69
1818,The Lady & Sons Savannah Country Cookbook,Forti,Khari,5.14
1877,Miller's Valley,Forti,Waldo,7.4
1953,No Man's Land (John Puller #4),Fortun Lohrmann,Lorie,6.64
1956,The Wicked Will Rise (Dorothy Must Die #2),Fortune,Ewing,2.27
1818,The Lost Gate (Mither Mages #1),Fortune,Rexford,7.22
1984,Today Will Be Different,Fortuni,Kizzie,2.3
1961,Half a War (Shattered Sea #3),Fortuni,Talmage,5.24
1773,The Greatest Salesman in the World,Fotopoulos,Mark,8.37
1762,The Husband,Fouche,James,2.77
1851,The Beautiful and Damned,Fountain,Branden,7.68
1961,The Magician's Apprentice (Black Magician #0.5),Fourie,Patrick,2.54
1941,The Atlantis Complex (Artemis Fowl #7),Fox,Marie,7.87
1851,Endlessly (Paranormalcy #3),Foxworth,Randolph,5.13
1777,Hunger,Fracassi,Clella,2.71
1879,Evermore (The Immortals #1),Fracassi,Celestino,2.62
1655,Revenge of the Witch (The Last Apprentice / Wardstone Chronicles #1),Franca,Emmet,8.18
1861,Attack on Titan: No Regrets Volume 01,Franch,Sophia,8.46
2006,Proof,Franco,Georgia,4.53
1759,Bitterblue (Graceling Realm #3),Franco,Sofia,4.74
1948,Fences (The Century Cycle #6),Franco,Soloman,1.63
1902,The Obelisk Gate (The Broken Earth #2),Francois,Maddison,7.4
1996,Small Sacrifices: A True Story of Passion and Murder,Frangulyan,Frederica,1.85
1820,Night of the Living Dummy (Goosebumps #7),Frankenhuis,Iyanna,6.3
1697,Flipped,Frankenhuis,Ollie,4.99
1730,James and the Giant Peach,Frankenhuis,Texas,2.4
1812,The Last Star (The 5th Wave #3),Frankova,Jerrold,6.35
1947,Preacher Volume 3: Proud Americans,Franta,Wallace,1.11
1742,Promised (One Night #1),Frantova,Symone,6.02
1879,A Fire Upon the Deep (Zones of Thought #1),Frappi,Vilma,10
1847,Rock Chick Regret (Rock Chick #7),Frawley,Grayce,3.89
1659,From Beirut to Jerusalem,Frawley,Jaiden,8.36
2016,A Game of Thrones: Comic Book Issue 1,Frawley,Justin,3.08
1994,Star Wars - Episode I: The Phantom Menace,Frazzitta,Emilia,9.93
1801,Lost in Time (Blue Bloods #6),Frech,Cathey,8.57
2017,The Demolished Man,Frech,Crissie,9.91
2001,Ascend (Trylle #3),Freebairn,Maiya,3.26
1654,The Ascent of Money: A Financial History of the World,Freeman,Daulton,5.88
1694,The Tao of Pooh,Fretz,Add,2.94
1841,Pleasure Unbound (Demonica #1),Freye Steur,Haiden,4.23
1931,Heretic (The Grail Quest #3),Friant,Rene,3.73
1930,Body Movers (Body Movers #1),Frias,Waldemar,1.51
1790,The Gate House,Friganovic,Carmen,9.27
1790,The Distant Hours,Frilling,Rosita,6.2
1809,Best Friends for Never (The Clique #2),Frioui,Deborrah,3.49
1940,The Black Arrow,Frisell,Zandra,1.73
1758,Where I Belong (Alabama Summer #1),Fritche,Kanesha,1.86
1871,The House of Hades (The Heroes of Olympus #4),Fritz,Niles,1.74
1768,The Poet (Jack McEvoy #1; Harry Bosch Universe #5),Fritz Krockow,Cecelia,1.05
2006,Now Discover Your Strengths,Fritz Krockow,Broderick,7.83
1894,Ringworld (Ringworld #1),Frlicka,Wanda,8.69
1781,Daring to Dream (Dream Trilogy #1),Frohlich,Woody,9.12
1850,2061: Odyssey Three (Space Odyssey #3),Froidevaux,Needham,9.33
1676,Stuart Little,Frolova,Kareem,4.79
1932,Gone (Gone #1),Fu,Krystina,4.25
1747,Mr. Brown Can Moo! Can You?,Fuchs,Serina,4.53
1726,Kiss of Death (The Morganville Vampires #8),Fuchs,Del,8.07
1763,Vampire Interrupted (Argeneau #9),Fuda,Jeffery,1.28
1910,Julie and Julia: 365 Days 524 Recipes 1 Tiny Apartment Kitchen: How One Girl Risked Her Marriage Her Job and Her Sanity to Master the Art of Living,Fuentes,Mason,4.89
1657,The Wrath of Mulgarath (The Spiderwick Chronicles #5),Fuentes,Norton,7.82
1791,Garden Spells (Waverley Family #1),Fuiorea,Elinor,8.5
1964,Fearless (The Lost Fleet #2),Fuiorea,Eula,2.14
1858,Locke & Key Vol. 1: Welcome to Lovecraft,Fujii,Pearline,8.89
1900,The Dark and Hollow Places (The Forest of Hands and Teeth #3),Fujii,Quincy,3.63
1730,S.,Fujii,Ardelle,2.4
1997,The Son,Fujioka,Abram,2.9
1665,Unraveling (Unraveling #1),Fujishiro,Eldridge,5.61
1686,Sail,Fujishiro,Rueben,4.52
1976,The Tin Drum,Fujiwara,Orma,5.12
1999,Reached (Matched #3),Fujiwara,Ricci,8.9
1959,Cross Bones (Temperance Brennan #8),Fujiwara,Richmond,1.99
2015,Naruto Vol. 01: The Tests of the Ninja (Naruto #1),Fujiwara,Bo,5.31
1668,I Am Pilgrim (Pilgrim #1),Fujiwara,Signa,7.9
1910,Ordinary Grace,Fukada,Will,5.4
1845,Hana-Kimi Vol. 1 (Hana-Kimi #1),Fukarkova,Leah,6.78
1925,Unfinished Tales of Númenor and Middle-Earth,Fukuda,Alby,1.47
1925,Cloud Atlas,Fukushima,Rose,9.96
1944,Scarlet (Scarlet #1),Fukuzawa,Irma,8.28
1696,Dark Fire (Dark #6),Fukuzawa,Jeramy,4.36
1832,American on Purpose: The Improbable Adventures of an Unlikely Patriot,Fuller,Kira,6.15
1876,The Drunkard's Walk: How Randomness Rules Our Lives,Fuller,Makenna,5.2
1954,The Inkheart Trilogy: Inkheart Inkspell Inkdeath (Inkworld #1-3),Funaki,Rachelle,3.86
1726,We Are Water,Furlanetto,Bobby,2.22
1650,How Soccer Explains the World,Furmaniak,Donavan,9.43
1926,The View from Saturday,Furuhashi,Jarret,3.48
1715,Never Never (Never Never #1),Furukawa,Fonda,1.1
1955,Spark Joy: An Illustrated Master Class on the Art of Organizing and Tidying Up,Furukawa,Cordero,8.44
1828,Sylvester and the Magic Pebble,Furukawa,Wells,4.9
1903,Release Me (Stark Trilogy #1),Fusai,Jep,3.21
1986,Queen of Babble (Queen of Babble #1),Fusai,Corie,8.81
1901,Pride of Baghdad,Fusai,Cleone,2.27
1694,Finger Lickin' Fifteen (Stephanie Plum #15),Fusano,Florence,7.56
1824,The Days Are Just Packed: A Calvin and Hobbes Collection,Fusano,Donato,2.34
1944,Eating the Dinosaur,Fusco,Frieda,5.76
1674,Everything Leads to You,Fusea,Raphael,5.1
1908,The Tenth Circle,Fusea,Ronna,2.47
2022,Someone Like You,Fusea,Roxann,9.78
1802,Suzanne's Diary for Nicholas,Fusinato,Janeen,7.48
1872,The Cat in the Hat Comes Back,Gabarrus Alonso,Daryn,2.46
1690,Snow Flower and the Secret Fan,Gabba,Arra,4.46
1652,The Cartel,Gabor,Georgeann,1.77
1820,The Auschwitz Escape,Gabor,Patti,6.81
1886,The Inheritance of Loss,Gabor,Dondre,4.13
1787,How the Grinch Stole Christmas!,Gabrielsen,Maegan,4.63
1803,Off to Be the Wizard (Magic 2.0 #1),Gabrielsen,Arlan,3.02
1739,A Higher Call: An Incredible True Story of Combat and Chivalry in the War-Torn Skies of World War II,Gabrisova,Estie,4.29
1755,Snow Like Ashes (Snow Like Ashes #1),Gabrovska,Delores,7.72
1889,Rilla of Ingleside (Anne of Green Gables #8),Gabueva,Lindbergh,9.33
1704,The Lost City of Faar (Pendragon #2),Gadanyi,Keenen,3.64
1865,Seven Up (Stephanie Plum #7),Gaddie,Allyson,5.84
1811,A Long Way Gone: Memoirs of a Boy Soldier,Gaddie,Cindi,2.95
1881,The Death of Bees,Gaddie,Sherri,1.51
1983,Legally Blonde,Gaddie,Vernetta,7.41
2003,Medium Raw: A Bloody Valentine to the World of Food and the People Who Cook,Gadroen,Kalene,4.86
1889,Eugénie Grandet,Gafni,Mirtie,5.19
1880,The Amber Room,Gafni,Verlin,8.1
1649,Taking Chances (Taking Chances #1),Gafurova,Josue,8.73
1945,Cress (The Lunar Chronicles #3),Gafurova,Levern,6.18
1797,The Demigod Files (Percy Jackson and the Olympians),Gafurova,Reubin,7.41
1803,Bullet (Anita Blake Vampire Hunter #19),Gaidano,Ovila,6.9
1852,The Hangman's Daughter (The Hangman's Daughter #1),Gaini,Sharen,2.25
1805,Trace (Kay Scarpetta #13),Gaini,Shayna,6.42
1970,Kushiel's Chosen (Phèdre's Trilogy #2),Gajo,Destiny,5.65
1675,Tyrannosaur Canyon (Wyman Ford #1),Gajo Torrell,Karissa,6.12
1767,Asylum (Asylum #1),Gajo Torrell,Lamarcus,7.91
1946,Ashes of Midnight (Midnight Breed #6),Gajo Torrell,Domonique,1.58
2013,It's in His Kiss (Bridgertons #7),Gajos,Lionel,8.51
1841,Pinocchio,Galal Hafez,Birdella,4.64
1794,Girl With Curious Hair,Galan,Coy,7.66
1830,Hairy Maclary from Donaldson's Dairy,Galan,Concetta,4.19
1665,Divine Misdemeanors (Merry Gentry #8),Galan Dominguez,Maureen,3.72
2023,River Cross My Heart,Galan Gomez,Gabrielle,6.04
1805,The Three Pigs,Galan Gomez,Bryce,2.32
2007,Why We Suck: A Feel Good Guide to Staying Fat Loud Lazy and Stupid,Galarza,Versa,1.46
1897,Born a Crime: Stories From a South African Childhood,Galayamova,Kasey,9.27
1731,The Rainbow Comes and Goes: A Mother and Son On Life Love and Loss,Galeano,Squire,9.94
1874,Bad Rep (Bad Rep #1),Galieva,Caitlyn,8.58
1844,Hetalia: Axis Powers Vol. 1 (Hetalia: Axis Powers #1),Galijasevic,Delora,3.96
1815,Heartbreaker (Buchanan-Renard #1),Galik,Kelly,3.5
1853,Unbroken: A World War II Story of Survival Resilience and Redemption,Galik,Stefani,5.92
1784,The Ruins of Gorlan (Ranger's Apprentice #1),Galikova,Antonia,7.84
1771,Slam,Galinier,Atlas,4.79
1893,Oblomov,Galinier,Lynnette,2.6
1723,The Maze Runner (Maze Runner #1),Galinier,Oran,6.19
1952,New York to Dallas (In Death #33),Galkina,Lelia,5.79
1710,The Black Box (Harry Bosch #18; Harry Bosch Universe #22),Gallardo,Tobias,6.14
1759,The Selection Stories: The Prince & The Guard (The Selection #0.5 2.5),Gallego Jover,Landon,7.58
1689,Midnight Crossroad (Midnight Texas #1),Galletto,Gabriela,4.33
1975,The Sleeping Doll (Kathryn Dance #1),Gallifa Puig Desens,Ermina,7.24
1787,Among the Impostors (Shadow Children #2),Gallifa Puig Desens,Gray,5.48
1712,Between the Lines (Between the Lines #1),Gallinal,Alonza,6.14
1764,Wallbanger (Cocktail #1),Gallinal,Son,2.05
1942,Miss Peregrine’s Home for Peculiar Children (Miss Peregrine’s Peculiar Children #1),Gallios,Delsie,2.47
1715,1491: New Revelations of the Americas Before Columbus,Gallios,Trevor,6.15
1828,Sentimental Education,Gallo Gomez,Lashunda,4.45
1863,The Far Pavilions,Gallo Gomez,Lucien,3.26
1858,Perfect Shadow (Night Angel #0.5),Galloway,Taja,6.94
1937,Alice in Wonderland,Galoustova,Ah,3.54
1820,The Best of Me,Galt,Cristofer,8.6
1880,Hard Choices,Galt,Hope,5.96
2005,Physik (Septimus Heap #3),Gamarra,Jarrett,4.9
1716,Visions of Heat (Psy-Changeling #2),Gamarra,Olin,1.59
1916,Angelology (Angelology #1),Gamarra Martins,Jemal,4.03
1990,Takedown (Scot Harvath #5),Gambadoro,Kellan,9.95
1741,The English Patient,Gambale,Isaak,2.6
1711,The Lord of the Rings: Weapons and Warfare,Gambale,Stephani,8.73
1888,The Way the Crow Flies,Gambey,Lucie,5.49
1895,Dance with the Devil (Dark-Hunter #3),Gamboa,Felicia,8.33
1694,Branded by Fire (Psy-Changeling #6),Gamboa,Flo,2.59
1975,Almost French: Love and a New Life in Paris,Gamboa,Ione,1.47
1656,Maisie Dobbs (Maisie Dobbs #1),Gamboa,Johnathan,5.88
1893,Give and Take: A Revolutionary Approach to Success,Gamboa,Mearl,7.06
1948,Julie of the Wolves (Julie of the Wolves #1),Gamboa,Adelle,3.04
2006,Robinson Crusoe,Gamboa,Rose,4.87
1961,The Madonnas of Leningrad,Gamiz,Arletta,2.21
1922,What to Expect When You're Expecting,Gamiz,Emilie,3.45
1976,Left Drowning (Left Drowning #1),Gamperli,Erica,1.21
1717,The Melancholy Death of Oyster Boy and Other Stories,Ganaha,Edmund,7.88
1898,The Charterhouse of Parma,Gandia,Doug,4.32
2012,Leonardo's Notebooks,Gandia,Peter,2.33
2004,Crystal Singer (Crystal Singer #1),Ganeva,Collier,6.79
2000,Revenge of the Wannabes (The Clique #3),Ganga,Tena,5.68
1809,Fortunately the Milk,Ganic,Celeste,2.24
1827,Eve (Eve #1),Gans,Trevion,3.96
1996,Dark Angel (Casteel #2),Gantcheva,Ballard,9.93
1657,The Beginning of Everything,Gantcheva,Rusty,6.3
1935,Six Easy Pieces: Essentials of Physics By Its Most Brilliant Teacher,Gantman,Tinnie,6.35
1765,Act Like a Lady Think Like a Man: What Men Really Think About Love Relationships Intimacy and Commitment,Ganzer,Ava,6.42
1746,Midnight Alley (The Morganville Vampires #3),Gao,Duncan,1.22
1955,The Way of Zen,Gao,Vera,2.02
1929,Gorky Park (Arkady Renko #1),Garavani,Greggory,1.65
1793,Rumpelstiltskin,Garavani,Lott,6.47
1972,The Black Widow (Gabriel Allon #16),Garbay,Emelia,1.16
1785,The Elfstones of Shannara  (The Original Shannara Trilogy #2),Garbay,Darleen,6.04
2023,Ouran High School Host Club Vol. 4 (Ouran High School Host Club #4),Garbellotto,Luvinia,3.94
1792,All My Puny Sorrows,Garbin,Jensen,8.64
1869,The Last Continent (Discworld #22; Rincewind #6),Garbin,Benjman,1.77
1982,The Belgariad Vol. 1: Pawn of Prophecy / Queen of Sorcery / Magician's Gambit (The Belgariad #1-3),Garceran,Rebekah,6.99
1925,The Story of Edgar Sawtelle,Garcia,Frederic,5.57
1976,Astonishing X-Men Volume 2: Dangerous,Garcia,Grisel,1.32
2007,The Mating  (Law of the Lycans #2),Garcia,Julian,4.23
1665,The Emperor's Code (The 39 Clues #8),Garcia,Mariam,7.09
1745,Mere Christianity,Garcia,Nelia,2.75
1664,Assata: An Autobiography,Garcia,Asberry,9.96
1748,The Husband's Secret Free Preview,Garcia,Sunny,6
1883,The Beast (Black Dagger Brotherhood #14),Garcia,Buna,4.2
1782,King (King #1),Garcia,Verona,5.46
1926,Hard Bitten (Chicagoland Vampires #4),Garcia,Zackery,2.9
1821,The Walking Dead Vol. 05: The Best Defense,Garcia Calvo,Ellery,6.78
1694,The Flame and the Flower,Garcia Calvo,Almedia,4.3
1874,Day by Day Armageddon (Day by Day Armageddon#1),Garcia Calvo,Rashaan,8.96
2013,Flaggermusmannen (Harry Hole #1),Garcia Diaz,Shandra,8.75
1733,The Marvelous Land of Oz (Oz #2),Garcia Fernandez,Dillard,6.65
1691,The Painted Girls,Garcia Gausi,Carlyn,4.85
1833,Swindle (Swindle #1),Garcia Herrera,Devan,9.15
1673,The Emperor's Soul,Garcia Jimenez,Dylon,4.43
1806,Vampire Academy Collection (Vampire Academy #1-3),Garcia Navas,Eric,9.67
1976,The Sense of an Ending,Garcia Pacual,Jack,8.79
1919,Too Late,Garcia Sokol,Tea,8.13
1878,A Death in Vienna (Gabriel Allon #4),Garcia Truchado,India,9.33
2002,An Occurrence at Owl Creek Bridge,Garcia Truchado,Kenny,2.35
1683,The Many Lives & Secret Sorrows of Josephine B. (Josephine Bonaparte #1),Gardiner,Tempie,5.14
1966,Notorious Nineteen (Stephanie Plum #19),Gardner,Destiny,6.66
1995,The Gates of Rome (Emperor #1),Garg,Nile,6.62
1902,Norwegian Wood,Gariglio,Gisselle,4.96
1977,Chosen Prey (Lucas Davenport #12),Gariglio,Hamp,3.37
1704,Kill Shot (Mitch Rapp #2),Gariglio,Rashaad,6.14
1801,Celebrity in Death (In Death #34),Gariglio,Zion,2.29
1795,Brilliance of the Moon (Tales of the Otori #3),Garnacho,Khiry,1.2
1936,Brimstone (Pendergast #5; Diogenes #1),Garrido Rodriguez,Wilbur,3.51
1911,Midnight Awakening (Midnight Breed #3),Garriga Catala,Lydia,8.88
1934,Demon Thief (The Demonata #2),Garrison,Rosaria,10
1670,Saga Vol. 6 (Saga #6),Garstea,Selmer,4.87
1910,Batman: Earth One Volume 1,Garth,Edra,9.16
1743,Body Double (Rizzoli & Isles #4),Garza Del Alto,Kimberlee,2.52
1957,The Discoverers: A History of Man's Search to Know His World and Himself,Gaso,Leigh,1.23
1686,The House of the Spirits,Gaso,Bambi,6.87
1747,The Darkest Passion (Lords of the Underworld #5),Gaspar,Cindi,3.11
1908,I Have Lived a Thousand Years,Gaspar,Flavia,2.58
1785,The Hunt for Red October (Jack Ryan Universe #4),Gaspar,Nolen,1.98
1822,The Cross of Lead (Crispin #1),Gaspar,Nyree,4.27
1751,The Door to December,Gaspar,Sterling,7.62
1805,The Sixth Extinction: An Unnatural History,Gaspar,Channie,5.91
1908,The Country Mouse and the City Mouse; The Fox and the Crow; The Dog and His Bone,Gasparri,Remington,7.96
1783,Dance Dance Dance (The Rat #4),Gates,Hernan,1.8
1820,Jealousy (Strange Angels #3),Gates,Mackenzie,3.99
1833,Skippyjon Jones,Gatt,Wilbert,7.05
1779,Private Games (Private #3),Gatti,Kyan,8.04
1904,Relentless,Gauthier,Andrew,7.53
1802,Cross Fire (Alex Cross #17),Gauvain,Iridian,7.32
1669,Survivor,Gavdunova,Jailene,6.46
1828,The Practice of the Presence of God,Gavenko,Jameel,6.27
1899,Spider's Bite (Elemental Assassin #1),Gavenko,Katelyn,8.23
1744,Charlie Bone and the Time Twister (The Children of the Red King #2),Gavril,Olen,8.44
1700,Under the Net,Gavrilova,Kimberley,3.16
1958,The Widow of the South,Gavrilova,Rosalind,5.84
1914,Zoe's Tale (Old Man's War #4),Gavrilova,Bailee,5.02
1886,The Magic of Recluce (The Saga of Recluce #1),Gavrilovic,Bettye,5.71
1949,Same Kind of Different as Me,Gawlik,Idell,3.39
1683,Shadows in Flight (Ender's Shadow #5),Gawlik,Moe,5.49
1853,Queen Song (Red Queen #0.1),Gazizova,Shaina,4.42
1943,Red Lily (In the Garden #3),Gbadamosi,Alec,4.72
1886,Moonrise (Warriors: The New Prophecy #2),Ge,Clara,7.49
1727,Tower Lord (Raven's Shadow #2),Gebert,Lurena,1.85
1817,Clear and Present Danger (Jack Ryan Universe #6),Gebreail,Dorthy,2.63
2021,Whitethorn Woods,Geeves,Brittanie,1.61
1650,Inherent Vice,Gegia,Sylvan,5.32
1658,Giovanni's Room,Gehrke,Percy,9.68
1919,The Taste of Home Cookbook,Geib,Bernie,5.81
1885,The Fallen Angel (Gabriel Allon #12),Geiss,Reginald,5.5
1733,Broken Homes (Peter Grant #4),Geissler,Esco,9.27
1976,Wolf-Speaker (Immortals #2),Geldenhuys,Dasia,5.94
1849,As Sure as the Dawn (Mark of the Lion #3),Geller,Lyndsey,2.59
1913,The Namesake,Gelo,Mel,5.98
1899,Real Murders (Aurora Teagarden #1),Gence,Abdullah,9.69
2003,Le bleu est une couleur chaude,Gence,Lular,7.69
1698,The Bitter Kingdom (Fire and Thorns #3),Gencsoy,Fulton,4.96
1934,The Enchantress Returns (The Land of Stories #2),Gencsoy,Hamza,5.6
2002,Passion (Fallen #3),Genisova,Elia,6.3
1758,Eleven Minutes,Genkova,Tessa,2.14
1772,Lit,Genovese,Arlyne,8.94
1799,Babylon's Ashes (The Expanse #6),Genovese,Joline,6.96
1651,The Miracle of Mindfulness: An Introduction to the Practice of Meditation,Genovese,Kathleen,5.23
1821,Murder at the Vicarage (Miss Marple #1),Genovese,Cash,1.3
1722,Eragon Eldest & Brisingr (Inheritance #1-3),Gentz,Hilda,8.24
1714,The Paris Wife,Gentz,Talon,5.26
1703,Four Blondes,Georgatou,Anabel,1.85
1729,This Song Will Save Your Life,George,Faustino,5.66
1724,Six Days of the Condor,George,Gardner,1.57
1981,On a Pale Horse (Incarnations of Immortality #1),George,Roby,6.09
1970,The Girl Who Chased the Moon,Georges,Evangelina,9.04
1794,The Scottish Prisoner (Lord John Grey #3),Georges,Pleas,9.6
1894,The Red and the Black,Georgescu,Krish,3.74
1926,The Flight of Gemma Hardy,Georgieva,Demarcus,7.48
1958,Bad Luck and Trouble (Jack Reacher #11),Geraniou,Maxwell,3.61
1749,The Lord of the Rings (The Lord of the Rings #1-3),Gerasimou,Desi,1.37
1789,The Complete Adventures of Curious George,Gerber,Ott,7.81
1847,The Titan's Curse (Percy Jackson and the Olympians #3),Germanlieva,Azalee,6.19
1962,An Anthropologist on Mars: Seven Paradoxical Tales,Germic,Shanon,1.16
2005,Rainbow Valley (Anne of Green Gables #7),Gerovac,Paul,8.96
1841,Wethering the Storm (The Storm #2),Gers,Magdalena,9.13
1872,Vanished (Callahan & McLane #1),Gers,Thomasina,5.06
1747,I Know Why the Caged Bird Sings,Gersi,Luella,2.97
1713,Live Wire (Myron Bolitar #10),Gersi,Viney,7.45
1749,The Twits,Gervais,Lucetta,8.51
1773,Bad Monkey,Geuer,Benito,8.09
1707,How the Irish Saved Civilization,Geuer,Kylah,1.87
1664,Enna Burning (The Books of Bayern #2),Gevel,Hazelle,9.52
1938,Magic Bites (Kate Daniels #1),Gevers,Leonidas,7.45
1709,Hardline (Hacker #3),Geyer,Quiana,3.21
1801,The Amber Spyglass (His Dark Materials #3),Geyer,Wayne,7.28
1992,Quidditch Through the Ages,Ghadri,Lonny,5.27
1863,Fall From Grace (Mad World #1),Ghaoui,Kellee,3.74
1940,My Best Friend's Girl,Ghaoui,Susann,5.03
1788,The Elves of Cintra (Genesis of Shannara #2),Ghedin,Raelynn,6.44
1773,Diary of a Worm,Gheisary,Elizebeth,5.65
1806,Clifford the Big Red Dog,Gherega,Keanna,1.42
1749,The Ugly Duckling,Gherghi,Ashlee,9.39
1764,Bone Gap,Ghica,Enoch,6.06
2014,These High Green Hills (Mitford Years #3),Ghiorghiu,Gerold,6.31
1770,Bossman,Ghiorghiu,Laura,8.35
1764,The Absolutely True Diary of a Part-Time Indian,Ghiorghiu,Sharleen,5.07
1773,The Vampire Prince (Cirque Du Freak #6),Ghirardi,Elsie,2.32
1872,Funny in Farsi: A Memoir of Growing Up Iranian in America,Ghitescu,Rogers,3.34
1671,A Dog's Life: The Autobiography of a Stray,Ghosh,Elizah,6.76
1953,School's Out—Forever (Maximum Ride #2),Giacalone,Cris,8.28
1971,Girls in Pants: The Third Summer of the Sisterhood (Sisterhood #3),Giacomin,Council,3.77
1830,P.S. I Love You,Giacomino,Edmund,6.36
1731,Knight (Unfinished Hero #1),Gianotti,Dinah,3.94
1654,Man's Search for Meaning,Gianotti,Desean,4.07
1902,Un Lun Dun,Giavazzi,Foster,3.59
1871,Heaven Texas (Chicago Stars #2),Giavazzi,Genaro,5.99
1776,If Chins Could Kill: Confessions of a B-Movie Actor,Giban,Kaden,1.23
1954,More Than a Carpenter,Giban,Marely,4.24
1883,Is Your Mama a Llama?,Gibanel Velasco,Elenora,6.21
1743,Just One Look,Gibson,Hedwig,7.1
1973,Breaking Point (Tom Clancy's Net Force #4),Gibson,Isaac,8.22
1944,Fever 1793,Gibson,Risa,3.49
1883,The Queen's Fool (The Plantagenet and Tudor Novels #12),Gibson,Clinton,1.8
1721,Tempt Me at Twilight (The Hathaways #3),Gideskog,Tammie,2.36
1829,The Speed of Trust: The One Thing that Changes Everything,Giger,Mirtie,4.96
1770,True Colors,Gil,Fred,8.4
2000,Hell House,Gil,Mai,5.44
1952,Kissing Coffins (Vampire Kisses #2),Gil Mateo Sasieta,Avie,6.78
1968,Y: The Last Man Vol. 6: Girl on Girl (Y: The Last Man #6),Gilbert,Marci,1.37
1814,Just One Day (Just One Day #1),Gilca,Wing,1.5
1666,The Bourne Objective (Jason Bourne #8),Gilchrist,Kacy,4.11
1909,Kindred in Death (In Death #29),Gilchrist,Clifton,3.72
1985,The Physician (Cole Family Trilogy #1),Gildemeister,Ariel,1.91
1953,Matterhorn,Giler,Izayah,5.84
1653,Full Moon o Sagashite Vol. 1,Gill,Lucetta,6.06
1702,Saphirblau (Edelstein-Trilogie #2),Gillan,Alby,3.44
1778,Come Back Amelia Bedelia,Gillespie Jones,Giada,8.15
1806,M.C. Escher: The Graphic Work,Gillis,Eulalia,6.32
1767,Serafina and the Black Cloak (Serafina #1),Gillis,Kenny,6.89
1934,Hannibal Rising (Hannibal Lecter #4),Gillis,Maida,5.59
1672,Memories Dreams Reflections,Giltinan,Tyrel,5.22
1880,The Emerald Atlas (The Books of Beginning #1),Gima,Lynda,8.94
1658,Savages,Gimberg,Del,9.08
1821,Awaken the Giant Within: How to Take Immediate Control of Your Mental Emotional Physical and Financial Destiny!,Gimenez Pena,Garner,8.59
1923,The Garden of Eden,Gimenez Pena,Lew,7.33
1872,The Litigators,Gingras,Alina,4.33
1695,Babe: The Gallant Pig,Giorgi,Luigi,6.07
1883,Ashes (Ashes Trilogy #1),Giorgi,Shoji,2.75
1745,Tripwire  (Jack Reacher #3),Giraldi Requena,Hubbard,7.8
2016,The Immortal Rules (Blood of Eden #1),Giraldi Requena,Walton,2.03
1849,Sexing the Cherry,Giraldo,Rogers,2.23
1858,The Blind Owl,Giraud,Matie,9.94
1671,The Flanders Panel,Girsang,Evia,3.49
1863,The Key to Rebecca,Giscafre,Everett,1.62
1920,Six Years,Gisonna,Jayden,6.05
1670,Not That Kind of Girl: A Young Woman Tells You What She's "Learned",Gisonna,Jerel,6.14
1946,See Jane Score (Chinooks Hockey Team #2),Gisonna,Newton,4.93
1662,Foreign Influence (Scot Harvath #9),Gisonna,Early,3.93
1906,Stolen Songbird (The Malediction Trilogy #1),Giudici,Minda,1.24
1914,Night Broken (Mercy Thompson #8),Giugni,Sammie,6.3
1926,Too Loud a Solitude,Giussani,Cyntha,7.58
1762,Roots: The Saga of an American Family,Giussani,Aniya,9.05
1826,Black Lies,Giusto,Khalil,2.34
1797,Fresh Wind Fresh Fire: What Happens When God's Spirit Invades the Heart of His People,Giusto,Terry,5.05
1808,My Friend Flicka (Flicka #1),Gjorcheska,Ronny,1.67
1879,Aleph,Gkogkou,Allie,5.51
1774,Blood on Snow (Blood on Snow #1),Glasper,Brigid,2.81
1726,Darkness Visible: A Memoir of Madness,Glatch,Rodrigo,9.46
1745,Life is What You Make It: A Story of Love Hope and How Determination Can Overcome Even Destiny,Glatch,Vander,4.06
1806,The Gospel According to Jesus Christ,Glavic,Coleton,6.08
1974,The Statistical Probability of Love at First Sight,Gleason,Lauryn,2.26
1693,Heidi,Gleason,Cary,1.45
1953,The Carnivorous Carnival (A Series of Unfortunate Events #9),Gligoric,Arnav,1.23
1748,Mirror Mirror,Glinzler,Rozella,4.62
1657,The Good House,Glisic,Brigid,2.12
1980,As Chimney Sweepers Come to Dust (Flavia de Luce #7),Gloria,Leatha,8.69
1919,Grim Tuesday (The Keys to the Kingdom #2),Gloria,Barrie,1.62
1718,Dark Matter,Glowacka,Jabez,9.11
1689,Boneshaker (The Clockwork Century #1),Glumac,Gael,2.32
1859,Someday Someday Maybe,Glumac,Tempie,1.67
1869,Cross Justice (Alex Cross #23),Glushenko,Dion,5.49
1702,Social Intelligence: The New Science of Human Relationships,Glushenko,Nella,2.21
1735,Northern Lights,Glushenko,Alonso,7.44
1981,Stone Cold Touch (The Dark Elements #2),Glushko,Caddie,7
1700,Drive: The Surprising Truth About What Motivates Us,Glynn,Thompson,3.37
1989,Red Country (First Law World #6),Gmeiner,Lamont,5.51
1774,Pretty Little Liars (TV Series),Gocheva,Edmon,1.78
1979,Never Never: Part Two (Never Never #2),Gocheva,Toccara,5.12
1945,The Myth of Sisyphus and Other Essays,Godridge,Merton,2.08
1733,The Sea of Monsters (Percy Jackson and the Olympians #2),Goedkoop,Anfernee,4.1
1827,Odd Apocalypse (Odd Thomas #5),Goel,Loma,1.22
1883,Forgotten,Goel,Marc,3.7
1941,Billy Lynn's Long Halftime Walk,Goel,Reason,5.98
1677,Absolute Power,Goerges,Meaghan,6.78
1725,Are You There God? It's Me Margaret,Gogvadze,Lilah,7.67
1880,Until Trevor (Until #2),Goia,Keisha,7.2
1978,The Desert Spear (Demon Cycle #2),Gol Alamo,Altha,2.6
1962,The Siren (The Original Sinners #1),Golder,Brandt,8.99
1825,One Step Behind  (Kurt Wallander #7),Goldfeld,Justyn,1.24
1680,Diagnostic and Statistical Manual of Mental Disorders DSM-IV-TR,Goldfeld,Karissa,5.7
2020,On the Island (On the Island #1),Goldfeld,Danielle,8.66
1884,The Arabian Nights,Goldsmith,Omari,2.11
1752,Labyrinths:  Selected Stories and Other Writings,Goldstein,Citlalli,7.15
1691,The Dead-Tossed Waves (The Forest of Hands and Teeth #2),Golfin,Lillie,4.22
1984,How to Cook Everything Vegetarian: Simple Meatless Recipes for Great Food,Golman,Bart,7.84
1863,The Sunne in Splendour,Golovin,Fritz,2.24
1705,Blindness,Golovin,Brandie,8.92
1947,Rebel Angels (Gemma Doyle #2),Goloviznina,Otis,4.28
1951,Staying Fat for Sarah Byrnes,Goloviznina,Claus,9.94
1992,Nutshell,Golubeva,Haywood,4.05
1778,The Nest,Golubeva,Ariana,2.28
1890,Tuck Everlasting,Gomer,Mena,1.17
1671,Strange Highways,Gomer,Noe,6.76
1685,The Lincoln Lawyer (Mickey Haller #1; Harry Bosch Universe #16),Gomez,Jalisa,8.77
1671,The Dream Hunter (Dark-Hunter #10 Dream-Hunter #1),Gomez,Kyler,4.28
1651,Carolina Moon,Gomez,Roberta,4.31
